{
	"cobrand_id" : 1234,
	"user_id" : 2345,
	"container" : "card",
	"transaction_list" : [
		{
			"transaction_id" : 1,
			"is_physical_merchant" : true,
			"match_found" : true,
			"merchant_name" : "Safeway",
			"store_id" : "#12",
			"category_labels" : ["Grocery", "Pharmacy"],
			"source" : "FACTUAL",
			"source_merchant_id" : "3ec075f0-33c2-11e4-8c21-0800200c9a66",
			"street" : "742 El Camino Real",
			"city" : "Sunnyvale",
			"state" : "CA",
			"country" : "US",
			"postal_code" : "94087"
		},
		{
			"transaction_id" : 2,
			"is_physical_merchant" : false,
			"category_labels" : ["bank_transfer"]
		},
		{
			"transaction_id" : 3,
			"is_physical_merchant" : false,
			"merchant_name" : "Amazon"
		},
		{
			"transaction_id" : 4,
			"is_physical_merchant" : true,
			"match_found" : false
		},
		{
			"transaction_id" : 5,
			"is_physical_merchant" : false,
			"match_found" : false
		}
	]
}
